{
	"schemaVersion": 1,
	"stage": "stage-3-browser-agent-runtimes",
	"capturedAt": "2026-07-15T14:57:33.586Z",
	"run": {
		"id": "stage3-20260715t145706z-3665de55",
		"logRoot": "evidence/stage-3-runtimes-run",
		"temporaryRoot": "/tmp/devenv-stage2-stage3-20260715t145706z-3665de55"
	},
	"source": {
		"baseSha": "2a2d4ab71723a608e7170d93a47622b6d92d2fac",
		"implementationSha": "3665de558333f4920c81b042514961129900ad8c",
		"featureTreeClean": true
	},
	"image": {
		"tag": "devenv-stage3-edaa9dd",
		"imageId": "sha256:540356e0a64f9b8386396e6e701a0c9bd66957f7bba9baf0f38167334ca9f40a",
		"architecture": "arm64",
		"os": "linux",
		"pins": {
			"playwright": "1.59.1",
			"codex": "0.144.4",
			"gemini": "0.50.0",
			"graphify": "0.9.16",
			"claude": "2.1.210",
			"ccstatusline": "2.2.23",
			"context7": "3.2.3",
			"octopusCommit": "f42f34a8f9a7ee5b9324e8b2d23159878c132b02",
			"octopusSha256": "64104245973939c1508babb4503bef56fdf455ffe57370758a8d07fbc0866263",
			"warpCommit": "58c823da195346a7e6645fd2d9484d0e38db6bc2",
			"warpSha256": "054607a80b7eb5571615925a6991082091d063b4eac591499177716421f76557"
		}
	},
	"commands": [
		{
			"id": "image-inspect",
			"command": [
				"docker",
				"image",
				"inspect",
				"--format",
				"{{json .Id}}|{{json .Architecture}}|{{json .Os}}",
				"devenv-stage3-edaa9dd"
			],
			"runId": "stage3-20260715t145706z-3665de55",
			"startedAt": "2026-07-15T14:57:06.493Z",
			"completedAt": "2026-07-15T14:57:06.536Z",
			"durationMs": 43,
			"stdoutPath": "evidence/stage-3-runtimes-run/image-inspect.stdout",
			"stderrPath": "evidence/stage-3-runtimes-run/image-inspect.stderr",
			"stdoutSha256": "f38dcd6dbce895b2b29389b87a1b453cff88ea4fa093867a86a1894257cc4e1f",
			"stderrSha256": "e3b0c44298fc1c149afbf4c8996fb92427ae41e4649b934ca495991b7852b855",
			"exitCode": 0,
			"status": "pass"
		},
		{
			"id": "warm-browser-build",
			"command": [
				"docker",
				"buildx",
				"build",
				"--file",
				".devcontainer/Dockerfile",
				"--platform",
				"linux/arm64",
				"--target",
				"development_browser",
				"--tag",
				"devenv-stage3-edaa9dd",
				"--progress",
				"plain",
				"--load",
				"."
			],
			"runId": "stage3-20260715t145706z-3665de55",
			"startedAt": "2026-07-15T14:57:06.539Z",
			"completedAt": "2026-07-15T14:57:09.874Z",
			"durationMs": 3335,
			"stdoutPath": "evidence/stage-3-runtimes-run/warm-browser-build.stdout",
			"stderrPath": "evidence/stage-3-runtimes-run/warm-browser-build.stderr",
			"stdoutSha256": "e3b0c44298fc1c149afbf4c8996fb92427ae41e4649b934ca495991b7852b855",
			"stderrSha256": "74741491c2c6fa11bcedd432b6ae946e57cc54bf28eb9a949fdd59ff4b9a3d1a",
			"exitCode": 0,
			"status": "pass"
		},
		{
			"id": "browser-preflight",
			"command": [
				"docker",
				"run",
				"--rm",
				"--mount",
				"type=bind,src=.,dst=/workspace,readonly",
				"--workdir",
				"/workspace",
				"devenv-stage3-edaa9dd",
				"/usr/bin/env",
				"-u",
				"BASH_ENV",
				"-u",
				"ENV",
				"-u",
				"BUN_OPTIONS",
				"-u",
				"NODE_OPTIONS",
				"/bin/bash",
				"-p",
				"-c",
				"/usr/bin/env -i HOME=/home/vscode PATH=/usr/bin:/bin /bin/bash -p /usr/local/share/devenv-image/setup-proto.sh && bun run browser:preflight"
			],
			"runId": "stage3-20260715t145706z-3665de55",
			"startedAt": "2026-07-15T14:57:09.875Z",
			"completedAt": "2026-07-15T14:57:12.485Z",
			"durationMs": 2610,
			"stdoutPath": "evidence/stage-3-runtimes-run/browser-preflight.stdout",
			"stderrPath": "evidence/stage-3-runtimes-run/browser-preflight.stderr",
			"stdoutSha256": "647e76da6045c4a7907569bdfdce2525233349c044967f6bc636886c450228fb",
			"stderrSha256": "ad36c27c7a0b8d3fe0754fcbbd0879eec89f1730d81cb8c25861ecc40d7347b2",
			"exitCode": 0,
			"status": "pass"
		},
		{
			"id": "launcher-smoke",
			"command": [
				"docker",
				"run",
				"--rm",
				"--mount",
				"type=bind,src=.,dst=/workspace,readonly",
				"--workdir",
				"/workspace",
				"--entrypoint",
				"/bin/bash",
				"devenv-stage3-edaa9dd",
				"-p",
				"-c",
				"/usr/bin/env -i HOME=/home/vscode PATH=/usr/bin:/bin /bin/bash -p /usr/local/share/devenv-image/setup-proto.sh && /bin/bash -p /workspace/scripts/template/run-stage-three-image-smoke.sh launchers"
			],
			"runId": "stage3-20260715t145706z-3665de55",
			"startedAt": "2026-07-15T14:57:12.487Z",
			"completedAt": "2026-07-15T14:57:15.781Z",
			"durationMs": 3294,
			"stdoutPath": "evidence/stage-3-runtimes-run/launcher-smoke.stdout",
			"stderrPath": "evidence/stage-3-runtimes-run/launcher-smoke.stderr",
			"stdoutSha256": "f5e7d40bdd80cef22ddc075e917db8f0fe94312c9204d0488f8d2dfd164bb543",
			"stderrSha256": "e3b0c44298fc1c149afbf4c8996fb92427ae41e4649b934ca495991b7852b855",
			"exitCode": 0,
			"status": "pass"
		},
		{
			"id": "plugin-repair-smoke",
			"command": [
				"docker",
				"run",
				"--rm",
				"--mount",
				"type=bind,src=.,dst=/workspace,readonly",
				"--workdir",
				"/workspace",
				"--tmpfs",
				"/home/vscode/.claude:uid=1000,gid=1000,mode=0755",
				"--tmpfs",
				"/home/vscode/.codex:uid=1000,gid=1000,mode=0755",
				"--entrypoint",
				"/bin/bash",
				"devenv-stage3-edaa9dd",
				"-p",
				"-c",
				"/usr/bin/env -i HOME=/home/vscode PATH=/usr/bin:/bin /bin/bash -p /usr/local/share/devenv-image/setup-proto.sh && /bin/bash -p /workspace/scripts/template/run-stage-three-image-smoke.sh plugins"
			],
			"runId": "stage3-20260715t145706z-3665de55",
			"startedAt": "2026-07-15T14:57:15.781Z",
			"completedAt": "2026-07-15T14:57:25.445Z",
			"durationMs": 9664,
			"stdoutPath": "evidence/stage-3-runtimes-run/plugin-repair-smoke.stdout",
			"stderrPath": "evidence/stage-3-runtimes-run/plugin-repair-smoke.stderr",
			"stdoutSha256": "9d296830f5e9eedac63e95041db074a6b37e64dc733eb97c1ff9d0ce6e60980b",
			"stderrSha256": "e3b0c44298fc1c149afbf4c8996fb92427ae41e4649b934ca495991b7852b855",
			"exitCode": 0,
			"status": "pass"
		},
		{
			"id": "shell-bash-login",
			"command": [
				"docker",
				"run",
				"--rm",
				"devenv-stage3-edaa9dd",
				"bash",
				"-lc",
				"command -v bun; command -v proto; command -v codex; printf \"%s\\n\" \"$PATH\""
			],
			"runId": "stage3-20260715t145706z-3665de55",
			"startedAt": "2026-07-15T14:57:25.446Z",
			"completedAt": "2026-07-15T14:57:25.883Z",
			"durationMs": 437,
			"stdoutPath": "evidence/stage-3-runtimes-run/shell-bash-login.stdout",
			"stderrPath": "evidence/stage-3-runtimes-run/shell-bash-login.stderr",
			"stdoutSha256": "1e679d68195328a2fba46587c2bee7357ab05f9f985729554f2e4ba01946b3c2",
			"stderrSha256": "e3b0c44298fc1c149afbf4c8996fb92427ae41e4649b934ca495991b7852b855",
			"exitCode": 0,
			"status": "pass"
		},
		{
			"id": "shell-bash-non-login",
			"command": [
				"docker",
				"run",
				"--rm",
				"devenv-stage3-edaa9dd",
				"bash",
				"-c",
				"command -v bun; command -v proto; command -v codex; printf \"%s\\n\" \"$PATH\""
			],
			"runId": "stage3-20260715t145706z-3665de55",
			"startedAt": "2026-07-15T14:57:25.884Z",
			"completedAt": "2026-07-15T14:57:26.300Z",
			"durationMs": 416,
			"stdoutPath": "evidence/stage-3-runtimes-run/shell-bash-non-login.stdout",
			"stderrPath": "evidence/stage-3-runtimes-run/shell-bash-non-login.stderr",
			"stdoutSha256": "e7790aac356ddfb6b287b321e14f35950478ee745ae63438600b5c3d98f903c7",
			"stderrSha256": "e3b0c44298fc1c149afbf4c8996fb92427ae41e4649b934ca495991b7852b855",
			"exitCode": 0,
			"status": "pass"
		},
		{
			"id": "shell-zsh-login",
			"command": [
				"docker",
				"run",
				"--rm",
				"devenv-stage3-edaa9dd",
				"zsh",
				"-lc",
				"command -v bun; command -v proto; command -v codex; printf \"%s\\n\" \"$PATH\""
			],
			"runId": "stage3-20260715t145706z-3665de55",
			"startedAt": "2026-07-15T14:57:26.301Z",
			"completedAt": "2026-07-15T14:57:26.709Z",
			"durationMs": 408,
			"stdoutPath": "evidence/stage-3-runtimes-run/shell-zsh-login.stdout",
			"stderrPath": "evidence/stage-3-runtimes-run/shell-zsh-login.stderr",
			"stdoutSha256": "74481b0110b9e92ee693b9f593d9cd0de03e4df2dfc358a15014dbb339d36024",
			"stderrSha256": "e3b0c44298fc1c149afbf4c8996fb92427ae41e4649b934ca495991b7852b855",
			"exitCode": 0,
			"status": "pass"
		},
		{
			"id": "shell-zsh-non-login",
			"command": [
				"docker",
				"run",
				"--rm",
				"devenv-stage3-edaa9dd",
				"zsh",
				"-c",
				"command -v bun; command -v proto; command -v codex; printf \"%s\\n\" \"$PATH\""
			],
			"runId": "stage3-20260715t145706z-3665de55",
			"startedAt": "2026-07-15T14:57:26.710Z",
			"completedAt": "2026-07-15T14:57:27.091Z",
			"durationMs": 381,
			"stdoutPath": "evidence/stage-3-runtimes-run/shell-zsh-non-login.stdout",
			"stderrPath": "evidence/stage-3-runtimes-run/shell-zsh-non-login.stderr",
			"stdoutSha256": "e7790aac356ddfb6b287b321e14f35950478ee745ae63438600b5c3d98f903c7",
			"stderrSha256": "e3b0c44298fc1c149afbf4c8996fb92427ae41e4649b934ca495991b7852b855",
			"exitCode": 0,
			"status": "pass"
		},
		{
			"id": "browser-known-bad-fixtures",
			"command": ["bun", "test", "scripts/template/__tests__/browser.test.ts"],
			"runId": "stage3-20260715t145706z-3665de55",
			"startedAt": "2026-07-15T14:57:27.092Z",
			"completedAt": "2026-07-15T14:57:28.099Z",
			"durationMs": 1007,
			"stdoutPath": "evidence/stage-3-runtimes-run/browser-known-bad-fixtures.stdout",
			"stderrPath": "evidence/stage-3-runtimes-run/browser-known-bad-fixtures.stderr",
			"stdoutSha256": "ca35b94f2c5b623fccbd1cc9e77eef3e30a6fcf4b045842fc1353f7ae6d8ea32",
			"stderrSha256": "37a0ce29f14aa8f6a7369fb43f430350e7e7cbb8d051ee49e5406bd4e6c8d8eb",
			"exitCode": 0,
			"status": "pass"
		},
		{
			"id": "agent-known-bad-fixtures",
			"command": ["bun", "test", "scripts/template/__tests__/image.test.ts"],
			"runId": "stage3-20260715t145706z-3665de55",
			"startedAt": "2026-07-15T14:57:28.099Z",
			"completedAt": "2026-07-15T14:57:28.723Z",
			"durationMs": 624,
			"stdoutPath": "evidence/stage-3-runtimes-run/agent-known-bad-fixtures.stdout",